{
  "schema_version": "1.0",
  "normalizer_version": "0.2.0",
  "source": {
    "procedure_code": "1.013628",
    "title": "Thủ tục cho phép cơ sở khám bệnh, chữa bệnh được tiếp tục hoạt động sau khi bị đình chỉ.",
    "raw_structured_parser_version": "0.1.0",
    "field": "Khám bệnh, chữa bệnh BQP"
  },
  "procedure": {
    "level": "Cấp bộ/ngành",
    "procedure_type": "TTHC được luật giao quy định chi tiết",
    "target_users": [
      "Tổ chức (không bao gồm doanh nghiệp",
      "HTX)"
    ],
    "authorities": [
      "Cục Quân y/Tổng cục Hậu cần - Kỹ thuật"
    ],
    "receiving_places": []
  },
  "submission": {
    "channels": [
      "in_person",
      "postal"
    ],
    "methods": [
      {
        "method_id": "method_1",
        "channel": "postal",
        "processing_time_text": "35 ngày",
        "fee_text": null,
        "description": null,
        "is_online": false,
        "is_postal": true,
        "is_in_person": false
      },
      {
        "method_id": "method_2",
        "channel": "in_person",
        "processing_time_text": "35 ngày",
        "fee_text": null,
        "description": null,
        "is_online": false,
        "is_postal": false,
        "is_in_person": true
      }
    ],
    "timing_summary": {
      "unique_processing_times": [
        "35 ngày"
      ],
      "method_count": 2
    }
  },
  "documents": {
    "required": [
      {
        "document_id": "n_ngh_c_ti_p_t_c_ho_t_ng_kh_m_b_nh_ch_a_b_nh_theo_m_u_s_05_ph_l_c_ii_k_m_theo_ngh_nh_s_16_2024_n_cp",
        "name": "Đơn đề nghị được tiếp tục hoạt động khám bệnh, chữa bệnh theo Mẫu số 05 Phụ lục II kèm theo Nghị định số 16/2024/NĐ-CP;",
        "group_name": "default",
        "group_type": "unknown",
        "original_count": "1",
        "copy_count": "0",
        "conditions": [],
        "attachment_label": null,
        "attachment_path": null
      },
      {
        "document_id": "b_o_c_o_v_vi_c_kh_c_ph_c_sai_s_t_chuy_n_m_n_ho_c_c_c_bi_n_ph_p_th_c_hi_n_b_o_m_c_c_i_u_ki_n_quy_nh_t_i_c_c_i_u_18_19_20_21_22_23_v_24_ngh_nh_s_16_2024_n_cp_t_y_theo_h_nh_th_c_t_ch_c_c_s_kh_m_b_nh_ch_a_b_nh_c_x_c_nh_n_c_a_n_v_c_p_tr_c_thu_c_b_qu_c_ph_ng_c_c_t_i_li_u_li_n_quan",
        "name": "Báo cáo về việc khắc phục sai sót chuyên môn hoặc các biện pháp đã thực hiện để bảo đảm các điều kiện quy định tại các Điều 18, 19, 20, 21, 22, 23 và 24 Nghị định số 16/2024/NĐ-CP (tùy theo hình thức tổ chức cơ sở khám bệnh, chữa bệnh) có xác nhận của đơn vị cấp trực thuộc Bộ Quốc phòng; các tài liệu liên quan.",
        "group_name": "default",
        "group_type": "unknown",
        "original_count": "1",
        "copy_count": "0",
        "conditions": [],
        "attachment_label": null,
        "attachment_path": null
      }
    ],
    "conditional": [],
    "presented": [],
    "notes": [],
    "forms": [],
    "empty_groups": [],
    "document_count": 2
  },
  "process": {
    "steps": [
      {
        "step_id": "step_1",
        "title": null,
        "content": "1.",
        "actor": "user",
        "channel_hint": null,
        "time_hint": null
      },
      {
        "step_id": "step_2",
        "title": "Bước 1.",
        "content": "Bước 1. Cơ sở khám bệnh, chữa bệnh gửi 01 bộ hồ sơ quy định tại khoản 1 Điều 32 Nghị định số 16/2024/NĐ-CP trực tiếp hoặc qua đường bưu chính hoặc trên môi trường điện tử về đơn vị đầu mối trực thuộc Bộ Quốc phòng. Trường hợp hồ sơ hợp lệ, trong thời hạn 15 ngày, kể từ ngày nhận được hồ sơ, đơn vị đầu mối trực thuộc Bộ Quốc phòng tổng hợp, lập danh sách gửi Cơ quan được giao quản lý về y tế kèm theo hồ sơ đề nghị của cơ sở và công văn đề nghị của thủ trưởng đơn vị từ cấp trung đoàn trở lên. Trường hợp hồ sơ không hợp lệ, trong thời hạn 15 ngày, kể từ ngày nhận được hồ sơ, đơn vị đầu mối trực thuộc Bộ Quốc phòng hoặc Cơ quan được giao quản lý về y tế phải có văn bản trả lời đơn vị gửi hồ sơ, trong đó nêu cụ thể lý do không hợp lệ, yêu cầu sửa đổi hoặc bổ sung tài liệu có trong hồ sơ đề nghị;",
        "actor": "authority",
        "channel_hint": "dịch vụ bưu chính",
        "time_hint": "15 ngày"
      },
      {
        "step_id": "step_3",
        "title": "Bước 2.",
        "content": "Bước 2. Trong thời hạn 10 ngày, kể từ ngày nhận được hồ sơ hợp lệ, Cơ quan được giao quản lý về y tế tiến hành xét duyệt hồ sơ báo cáo cơ quan có thẩm quyền quyết định cho phép cơ sở khám bệnh, chữa bệnh tiếp tục hoạt động chuyên môn; nếu không cho phép tiếp tục hoạt động chuyên môn thì phải có văn bản trả lời và nêu rõ lý do;",
        "actor": "authority",
        "channel_hint": null,
        "time_hint": "10 ngày"
      },
      {
        "step_id": "step_4",
        "title": "Bước 3.",
        "content": "Bước 3. Trong thời hạn 10 ngày, kể từ ngày nhận được tờ trình của Cơ quan được giao quản lý về y tế, cơ quan có thẩm quyền ban hành quyết định cho phép cơ sở khám bệnh, chữa bệnh tiếp tục hoạt động chuyên môn; nếu không cho phép tiếp tục hoạt động chuyên môn thì phải có văn bản trả lời và nêu rõ lý do.",
        "actor": "authority",
        "channel_hint": null,
        "time_hint": "10 ngày"
      }
    ],
    "step_count": 4,
    "notes": []
  },
  "eligibility": {
    "conditions": [],
    "has_conditions": false
  },
  "results": {
    "items": [
      {
        "name": "Quyết định cho phép tiếp tục hành nghề",
        "result_code": "G11.01.003.005-KQ0001",
        "raw_text": "Quyết định cho phép tiếp tục hành nghề"
      }
    ],
    "primary_result": {
      "name": "Quyết định cho phép tiếp tục hành nghề",
      "result_code": "G11.01.003.005-KQ0001",
      "raw_text": "Quyết định cho phép tiếp tục hành nghề"
    }
  },
  "legal_basis": {
    "items": [
      {
        "title": "Nghị định số 16/2024/NĐ-CP ngày 16/02/2024 của Chính phủ về người hành nghề khám bệnh, chữa bệnh và cơ sở khám bệnh, chữa bệnh thuộc lực lượng vũ trang nhân dân",
        "code": "16/2024/NĐ-CP"
      }
    ],
    "count": 1
  },
  "attachments": [],
  "signals": {
    "raw_parse_warnings": [],
    "missing_documents": false,
    "documents_section_present": true,
    "documents_declared_empty": false,
    "documents_only_in_notes": false,
    "missing_results": false
  }
}