{
  "schema_version": "1.0",
  "normalizer_version": "0.2.0",
  "source": {
    "procedure_code": "1.010385",
    "title": "Trình báo mất hộ chiếu phổ thông (thực hiện tại cấp huyện)",
    "raw_structured_parser_version": "0.1.0",
    "field": "Quản lý xuất nhập cảnh"
  },
  "procedure": {
    "level": null,
    "procedure_type": null,
    "target_users": [],
    "authorities": [
      "Công an huyện"
    ],
    "receiving_places": []
  },
  "submission": {
    "channels": [
      "in_person",
      "online",
      "postal"
    ],
    "methods": [
      {
        "method_id": "method_1",
        "channel": "in_person",
        "processing_time_text": "01 Ngày làm việc",
        "fee_text": null,
        "description": "Phí: 0 Đồng 01 ngày làm việc kể từ khi nhận đơn trình báo mất hộ chiếu phổ thông, Công an cấp huyện thông báo bằng văn bản cho người gửi đơn và Cục Quản lý xuất nhập cảnh; trong thời hạn 01 ngày làm việc kể từ ngày nhận được thông báo của Công an cấp huyện, Cục Quản lý xuất nhập cảnh thực hiện hủy giá trị sử dụng của hộ chiếu và thông báo về việc giải quyết đơn trình báo mất hộ chiếu cho người gửi đơn. Trực tiếp nộp hồ sơ tại trụ sở làm việc của Công an cấp huyện",
        "is_online": false,
        "is_postal": false,
        "is_in_person": true
      },
      {
        "method_id": "method_2",
        "channel": "online",
        "processing_time_text": "01 Ngày làm việc",
        "fee_text": null,
        "description": "Phí: 0 Đồng 01 ngày làm việc kể từ khi nhận đơn trình báo mất hộ chiếu phổ thông, Công an cấp huyện thông báo bằng văn bản cho người gửi đơn và Cục Quản lý xuất nhập cảnh; trong thời hạn 01 ngày làm việc kể từ ngày nhận được thông báo của Công an cấp huyện, Cục Quản lý xuất nhập cảnh thực hiện hủy giá trị sử dụng của hộ chiếu và thông báo về việc giải quyết đơn trình báo mất hộ chiếu cho người gửi đơn. Nộp hồ sơ trực tuyến qua Cổng Dịch vụ công quốc gia hoặc Cổng dịch vụ công Bộ Công an",
        "is_online": true,
        "is_postal": false,
        "is_in_person": false
      },
      {
        "method_id": "method_3",
        "channel": "postal",
        "processing_time_text": "01 Ngày làm việc",
        "fee_text": null,
        "description": "Phí: 0 Đồng 01 ngày làm việc kể từ khi nhận đơn trình báo mất hộ chiếu phổ thông, Công an cấp huyện thông báo bằng văn bản cho người gửi đơn và Cục Quản lý xuất nhập cảnh; trong thời hạn 01 ngày làm việc kể từ ngày nhận được thông báo của Công an cấp huyện, Cục Quản lý xuất nhập cảnh thực hiện hủy giá trị sử dụng của hộ chiếu và thông báo về việc giải quyết đơn trình báo mất hộ chiếu cho người gửi đơn. Nộp hồ sơ qua dịch vụ bưu chính",
        "is_online": false,
        "is_postal": true,
        "is_in_person": false
      }
    ],
    "timing_summary": {
      "unique_processing_times": [
        "01 Ngày làm việc"
      ],
      "method_count": 3
    }
  },
  "documents": {
    "required": [
      {
        "document_id": "01_n_tr_nh_b_o_m_t_h_chi_u_ph_th_ng_m_u_tk05_ban_h_nh_k_m_theo_th_ng_t_s_31_2023_tt_bca_ng_y_20_7_2023_c_a_b_c_ng_an_i_v_i_ng_i_m_t_n_ng_l_c_h_nh_vi_d_n_s_c_kh_kh_n_trong_nh_n_th_c_v_l_m_ch_h_nh_vi",
        "name": "01 đơn trình báo mất hộ chiếu phổ thông (mẫu TK05) ban hành kèm theo Thông tư số 31/2023/TT-BCA ngày 20/7/2023 của Bộ Công an. Đối với người mất năng lực hành vi dân sự, có khó khăn trong nhận thức và làm chủ hành vi,",
        "group_name": "default",
        "group_type": "required",
        "original_count": "1",
        "copy_count": "0",
        "conditions": [],
        "attachment_label": "người chưa đủ 14 tuổi thì người đại diện hợp pháp khai và ký thay. Mẫu TK05 báo mất HC 05 7 TK05 MỚI.doc",
        "attachment_path": "người chưa đủ 14 tuổi thì người đại diện hợp pháp khai và ký thay. Mẫu TK05 báo mất HC 05 7 TK05 MỚI.doc"
      }
    ],
    "conditional": [],
    "presented": [],
    "notes": [],
    "forms": [
      {
        "name": "01 đơn trình báo mất hộ chiếu phổ thông (mẫu TK05) ban hành kèm theo Thông tư số 31/2023/TT-BCA ngày 20/7/2023 của Bộ Công an. Đối với người mất năng lực hành vi dân sự, có khó khăn trong nhận thức và làm chủ hành vi,",
        "attachment_label": "người chưa đủ 14 tuổi thì người đại diện hợp pháp khai và ký thay. Mẫu TK05 báo mất HC 05 7 TK05 MỚI.doc",
        "attachment_path": "người chưa đủ 14 tuổi thì người đại diện hợp pháp khai và ký thay. Mẫu TK05 báo mất HC 05 7 TK05 MỚI.doc"
      }
    ],
    "empty_groups": [],
    "document_count": 1
  },
  "process": {
    "steps": [
      {
        "step_id": "step_1",
        "title": "Bước 1:",
        "content": "Bước 1: Chuẩn bị hồ sơ theo quy định của pháp luật.",
        "actor": "user",
        "channel_hint": null,
        "time_hint": null
      },
      {
        "step_id": "step_2",
        "title": "Bước 2:",
        "content": "Bước 2: Nộp hồ sơ * Công dân Việt Nam bị mất hộ chiếu phổ thông ở trong nước thực hiện việc trình báo mất hộ chiếu phổ thông qua Cổng dịch vụ công quốc gia, Cổng dịch vụ công Bộ Công an, thông qua dịch vụ bưu chính công ích hoặc tại trụ sở Công an cấp huyện nơi gần nhất. Khi đến nộp hồ sơ phải xuất trình Chứng minh nhân dân hoặc Thẻ căn cước công dân còn giá trị sử dụng để kiểm tra, đối chiếu. * Thời gian tiếp nhận hồ sơ: Từ thứ 2 đến thứ 6 hàng tuần và sáng thứ 7 (đối với các đơn vị bố trí tiếp nhận hồ sơ vào sáng thứ 7); trừ ngày Tết, ngày lễ. * Cán bộ tiếp nhận hồ sơ kiểm tra tính pháp lý và nội dung hồ sơ: + Nếu hồ sơ đầy đủ, hợp lệ thì tiếp nhận. + Nếu hồ sơ chưa đầy đủ, hợp lệ thì hướng dẫn người trình báo mất hộ chiếu hoàn chỉnh hồ sơ theo quy định.",
        "actor": "authority",
        "channel_hint": "dịch vụ bưu chính",
        "time_hint": null
      },
      {
        "step_id": "step_3",
        "title": "Bước 3:",
        "content": "Bước 3: Nhận kết quả Công an cấp huyện gửi thông báo về việc đã tiếp nhận đơn trình báo mất hộ chiếu phổ thông cho người gửi đơn.",
        "actor": "user",
        "channel_hint": null,
        "time_hint": null
      }
    ],
    "step_count": 3,
    "notes": []
  },
  "eligibility": {
    "conditions": [
      "Trong thời hạn 02 ngày làm việc kể từ ngày phát hiện hộ chiếu phổ thông bị mất, người bị mất hộ chiếu trực tiếp nộp hoặc gửi đơn báo mất hộ chiếu theo mẫu cho Công an cấp huyện hoặc trên môi trường điện tử tại Cổng dịch vụ công quốc gia hoặc Cổng dịch vục công Bộ Công an. Trường hợp vì lý do bất khả kháng, thời hạn nộp hoặc gửi đơn báo mất có thể dài hơn nhưng trong đơn phải giải thích cụ thể về lý do bất khả kháng."
    ],
    "has_conditions": true
  },
  "results": {
    "items": [],
    "primary_result": null
  },
  "legal_basis": {
    "items": [],
    "count": 0
  },
  "attachments": [
    {
      "label": "người chưa đủ 14 tuổi thì người đại diện hợp pháp khai và ký thay. Mẫu TK05 báo mất HC 05 7 TK05 MỚI.doc",
      "path": "người chưa đủ 14 tuổi thì người đại diện hợp pháp khai và ký thay. Mẫu TK05 báo mất HC 05 7 TK05 MỚI.doc",
      "source_section": "Thành phần hồ sơ",
      "document_name": "01 đơn trình báo mất hộ chiếu phổ thông (mẫu TK05) ban hành kèm theo Thông tư số 31/2023/TT-BCA ngày 20/7/2023 của Bộ Công an. Đối với người mất năng lực hành vi dân sự, có khó khăn trong nhận thức và làm chủ hành vi,"
    }
  ],
  "signals": {
    "raw_parse_warnings": [],
    "missing_documents": false,
    "documents_section_present": true,
    "documents_declared_empty": false,
    "documents_only_in_notes": false,
    "missing_results": true
  }
}