{
  "schema_version": "1.0",
  "normalizer_version": "0.2.0",
  "source": {
    "procedure_code": "2.001830",
    "title": "Cấp Giấy phép làm việc cho công dân Ô-xtơ-rây-li-a tham gia Chương trình Lao động kết hợp kỳ nghỉ tại Việt Nam",
    "raw_structured_parser_version": "0.1.0",
    "field": "Việc làm"
  },
  "procedure": {
    "level": null,
    "procedure_type": null,
    "target_users": [],
    "authorities": [
      "Cục Việc làm"
    ],
    "receiving_places": []
  },
  "submission": {
    "channels": [
      "in_person",
      "online",
      "postal"
    ],
    "methods": [
      {
        "method_id": "method_1",
        "channel": "in_person",
        "processing_time_text": "12 Ngày làm việc",
        "fee_text": null,
        "description": "Lệ phí: 600000 ĐồngXem chi tiết Công dân Ô-xtơ-rây-li-a nộp trực tiếp hoặc gửi qua dịch vụ bưu chính hoặc môi trường mạng (nếu đủ điều kiện áp dụng)",
        "is_online": false,
        "is_postal": false,
        "is_in_person": true
      },
      {
        "method_id": "method_2",
        "channel": "online",
        "processing_time_text": "12 Ngày làm việc",
        "fee_text": null,
        "description": "Lệ phí: 600000 ĐồngXem chi tiết Công dân Ô-xtơ-rây-li-a nộp trực tiếp hoặc gửi qua dịch vụ bưu chính hoặc môi trường mạng (nếu đủ điều kiện áp dụng)",
        "is_online": true,
        "is_postal": false,
        "is_in_person": false
      },
      {
        "method_id": "method_3",
        "channel": "postal",
        "processing_time_text": "12 Ngày làm việc",
        "fee_text": null,
        "description": "Lệ phí: 600000 ĐồngXem chi tiết Công dân Ô-xtơ-rây-li-a nộp trực tiếp hoặc gửi qua dịch vụ bưu chính hoặc môi trường mạng (nếu đủ điều kiện áp dụng)",
        "is_online": false,
        "is_postal": true,
        "is_in_person": false
      }
    ],
    "timing_summary": {
      "unique_processing_times": [
        "12 Ngày làm việc"
      ],
      "method_count": 3
    }
  },
  "documents": {
    "required": [
      {
        "document_id": "document",
        "name": "",
        "group_name": "default",
        "group_type": "required",
        "original_count": "1",
        "copy_count": "0",
        "conditions": [],
        "attachment_label": "2016) 6Mus4BanhnhkmtheoThngtlintchs21_2016.docx",
        "attachment_path": "Tờ khai đề nghị cấp Giấy phép làm việc kết hợp kỳ nghỉ (theo mẫu số 4 ban hành kèm theo Thông tư liên tịch số 21/2016/TTLT-BLĐTBXH-BCA-BNG ngày 29/6/2016) 6Mus4BanhnhkmtheoThngtlintchs21_2016.docx"
      },
      {
        "document_id": "h_chi_u_c_a_c_ng_d_n_xt_r_y_li_a_c_n_th_i_h_n_nhi_u_h_n_06_th_ng_t_nh_t_th_i_i_m_d_ki_n_tham_gia_ch_ng_tr_nh",
        "name": "Hộ chiếu của công dân Ô-xtơ-rây-li-a còn thời hạn nhiều hơn 06 tháng tính từ thời điểm dự kiến tham gia Chương trình",
        "group_name": "default",
        "group_type": "required",
        "original_count": "1",
        "copy_count": "0",
        "conditions": [],
        "attachment_label": null,
        "attachment_path": null
      },
      {
        "document_id": "c_v_m_y_bay_ho_c_gi_y_t_ch_ng_minh_c_m_t_kho_n_ti_n_mua_v_m_y_bay",
        "name": "Có vé máy bay hoặc giấy tờ chứng minh có một khoản tiền đủ để mua vé máy bay",
        "group_name": "default",
        "group_type": "required",
        "original_count": "1",
        "copy_count": "0",
        "conditions": [],
        "attachment_label": null,
        "attachment_path": null
      },
      {
        "document_id": "gi_y_ch_ng_nh_n_s_c_kh_e_c_c_p_kh_ng_qu_12_th_ng_t_nh_n_ng_y_n_p_h_s_ngh_c_p_gi_y_ph_p_l_m_vi_c",
        "name": "Giấy chứng nhận sức khỏe được cấp không quá 12 tháng tính đến ngày nộp hồ sơ đề nghị cấp giấy phép làm việc",
        "group_name": "default",
        "group_type": "required",
        "original_count": "1",
        "copy_count": "0",
        "conditions": [],
        "attachment_label": null,
        "attachment_path": null
      },
      {
        "document_id": "phi_u_l_l_ch_t_ph_p_ho_c_v_n_b_n_c_gi_tr_t_ng_ng_c_c_p_kh_ng_qu_06_th_ng_t_nh_n_ng_y_n_p_h_s_ngh_c_p_gi_y_ph_p_l_m_vi_c",
        "name": "Phiếu lý lịch tư pháp hoặc văn bản có giá trị tương đương được cấp không quá 06 tháng tính đến ngày nộp hồ sơ đề nghị cấp giấy phép làm việc",
        "group_name": "default",
        "group_type": "required",
        "original_count": "1",
        "copy_count": "0",
        "conditions": [],
        "attachment_label": null,
        "attachment_path": null
      },
      {
        "document_id": "b_ng_t_t_nghi_p_tr_nh_i_h_c_ho_c_gi_y_t_ch_ng_minh_ho_n_th_nh_t_nh_t_02_n_m_i_h_c_ch_nh_quy",
        "name": "Bằng tốt nghiệp trình độ đại học hoặc giấy tờ chứng minh đã hoàn thành ít nhất 02 năm đại học chính quy",
        "group_name": "default",
        "group_type": "required",
        "original_count": "1",
        "copy_count": "0",
        "conditions": [],
        "attachment_label": null,
        "attachment_path": null
      },
      {
        "document_id": "th_gi_i_thi_u_c_a_c_quan_c_th_m_quy_n_c_a_ch_nh_ph_xt_r_y_li_a_ng_cho_l_u_tr_t_i_vi_t_nam_theo_c_c_i_u_kho_n_c_a_ch_ng_tr_nh_gi_y_t_quy_nh_t_i_c_c_kho_n_c_2_c_3_c_4_c_5_c_6_v_c_7_l_01_b_n_sao_v_xu_t_tr_nh_b_n_ch_nh_i_chi_u_ho_c_01_b_n_sao_c_ch_ng_th_c_t_b_n_ch_nh",
        "name": "Thư giới thiệu của cơ quan có thẩm quyền của Chính phủ Ô-xtơ-rây-li-a đồng ý cho lưu trú tại Việt Nam theo các điều khoản của Chương trình. Giấy tờ quy định tại các khoản c.2, c.3, c.4, c.5, c.6 và c.7 là 01 bản sao và xuất trình bản chính để đối chiếu hoặc 01 bản sao được chứng thực từ bản chính.",
        "group_name": "default",
        "group_type": "required",
        "original_count": "1",
        "copy_count": "0",
        "conditions": [],
        "attachment_label": null,
        "attachment_path": null
      }
    ],
    "conditional": [],
    "presented": [],
    "notes": [],
    "forms": [
      {
        "name": "",
        "attachment_label": "2016) 6Mus4BanhnhkmtheoThngtlintchs21_2016.docx",
        "attachment_path": "Tờ khai đề nghị cấp Giấy phép làm việc kết hợp kỳ nghỉ (theo mẫu số 4 ban hành kèm theo Thông tư liên tịch số 21/2016/TTLT-BLĐTBXH-BCA-BNG ngày 29/6/2016) 6Mus4BanhnhkmtheoThngtlintchs21_2016.docx"
      }
    ],
    "empty_groups": [],
    "document_count": 7
  },
  "process": {
    "steps": [
      {
        "step_id": "step_1",
        "title": "Bước 1:",
        "content": "Bước 1: Trước thời hạn ít nhất 30 ngày kể từ ngày dự kiến nhập cảnh vào Việt Nam, công dân Ô-xtơ-rây-li-a nộp hồ sơ đề nghị cấp Giấy phép cho cơ quan đại diện ngoại giao, cơ quan đại diện lãnh sự của Việt Nam tại Ô-xtơ-rây-li-a (sau đây viết tắt là Cơ quan đại diện của Việt Nam);",
        "actor": "authority",
        "channel_hint": null,
        "time_hint": "30 ngày"
      },
      {
        "step_id": "step_2",
        "title": "Bước 2:",
        "content": "Bước 2: Trong vòng 05 ngày làm việc kể từ ngày nhận đủ hồ sơ đề nghị cấp Giấy phép của công dân Ô-xtơ-rây-li-a, Cơ quan đại diện của Việt Nam chuyển hồ sơ đó qua đường thư điện tử hoặc fax đến Cục Việc làm;",
        "actor": "authority",
        "channel_hint": null,
        "time_hint": "05 ngày làm việc"
      },
      {
        "step_id": "step_3",
        "title": "Bước 3:",
        "content": "Bước 3: Trong thời hạn 07 ngày làm việc kể từ ngày nhận đủ hồ sơ đề nghị cấp Giấy phép làm việc từ Cơ quan đại diện của Việt Nam, Cục Việc làm thông báo kết quả cấp giấy phép làm việc hoặc không cấp phép làm việc cho Cơ quan đại diện của Việt Nam bằng văn bản.",
        "actor": "authority",
        "channel_hint": null,
        "time_hint": "07 ngày làm việc"
      }
    ],
    "step_count": 3,
    "notes": []
  },
  "eligibility": {
    "conditions": [
      "- Hộ chiếu của công dân Ô-xtơ-rây-li-a còn thời hạn nhiều hơn 06 tháng tính từ thời điểm dự kiến tham gia Chương trình; - Có vé máy bay hoặc giấy tờ chứng minh có một khoản tiền đủ để mua vé máy bay; - Giấy chứng nhận sức khỏe được cấp không quá 12 tháng tính đến ngày nộp hồ sơ đề nghị cấp giấy phép làm việc; - Phiếu lý lịch tư pháp hoặc văn bản có giá trị tương đương được cấp không quá 06 tháng tính đến ngày nộp hồ sơ đề nghị cấp giấy phép làm việc; - Bằng tốt nghiệp trình độ đại học hoặc giấy tờ chứng minh đã hoàn thành ít nhất 02 năm đại học chính quy. - Thư giới thiệu của cơ quan có thẩm quyền của Chính phủ Ô-xtơ-rây-li-a đồng ý cho lưu trú tại Việt Nam theo các điều khoản của Chương trình; - Hằng năm, cấp tối đa 200 Giấy phép làm việc cho công dân Ô-xtơ-rây-li-a đáp ứng được các điều kiện theo quy định."
    ],
    "has_conditions": true
  },
  "results": {
    "items": [],
    "primary_result": null
  },
  "legal_basis": {
    "items": [],
    "count": 0
  },
  "attachments": [
    {
      "label": "2016) 6Mus4BanhnhkmtheoThngtlintchs21_2016.docx",
      "path": "Tờ khai đề nghị cấp Giấy phép làm việc kết hợp kỳ nghỉ (theo mẫu số 4 ban hành kèm theo Thông tư liên tịch số 21/2016/TTLT-BLĐTBXH-BCA-BNG ngày 29/6/2016) 6Mus4BanhnhkmtheoThngtlintchs21_2016.docx",
      "source_section": "Thành phần hồ sơ",
      "document_name": ""
    }
  ],
  "signals": {
    "raw_parse_warnings": [],
    "missing_documents": false,
    "documents_section_present": true,
    "documents_declared_empty": false,
    "documents_only_in_notes": false,
    "missing_results": true
  }
}