{
  "schema_version": "1.0",
  "normalizer_version": "0.2.0",
  "source": {
    "procedure_code": "3.000169",
    "title": "Cấp giấy phép nhập khẩu pháo hoa, thuốc pháo hoa tại Cục Cảnh sát quản lý hành chính về trật tự xã hội - Bộ Công an",
    "raw_structured_parser_version": "0.1.0",
    "field": "Quản lý vũ khí, vật liệu nổ, công cụ hỗ trợ và pháo"
  },
  "procedure": {
    "level": "Cấp bộ/ngành",
    "procedure_type": "OTHER",
    "target_users": [
      "Tổ chức (không bao gồm doanh nghiệp",
      "HTX)",
      "Doanh nghiệp",
      "Hợp tác xã"
    ],
    "authorities": [
      "Cục cảnh sát quản lý hành chính về trật tự, xã hội"
    ],
    "receiving_places": []
  },
  "submission": {
    "channels": [
      "in_person",
      "online",
      "postal"
    ],
    "methods": [
      {
        "method_id": "method_1",
        "channel": "online",
        "processing_time_text": "5 ngày làm việc",
        "fee_text": null,
        "description": "Nộp hồ sơ, nhận kết quả qua Cổng dịch vụ công (trừ các văn bản, giấy tờ không được phép đăng tải qua hệ thống mạng theo quy định của pháp luật).",
        "is_online": true,
        "is_postal": false,
        "is_in_person": false
      },
      {
        "method_id": "method_2",
        "channel": "postal",
        "processing_time_text": "5 ngày làm việc",
        "fee_text": null,
        "description": "Nộp hồ sơ, trả kết quả qua dịch vụ bưu chính.",
        "is_online": false,
        "is_postal": true,
        "is_in_person": false
      },
      {
        "method_id": "method_3",
        "channel": "in_person",
        "processing_time_text": "5 ngày làm việc",
        "fee_text": null,
        "description": "Nộp hồ sơ, trả kết quả trực tiếp tại bộ phận tiếp nhận hồ sơ của Cục Cảnh sát quản lý hành chính về trật tự xã hội, Bộ Công an.",
        "is_online": false,
        "is_postal": false,
        "is_in_person": true
      }
    ],
    "timing_summary": {
      "unique_processing_times": [
        "5 ngày làm việc"
      ],
      "method_count": 3
    }
  },
  "documents": {
    "required": [],
    "conditional": [
      {
        "document_id": "v_n_b_n_ngh_ghi_r_t_n_a_ch_c_a_t_ch_c_doanh_nghi_p_thu_c_b_qu_c_ph_ng_m_s_doanh_nghi_p_s_ng_y_c_p_gi_y_ch_ng_nh_n_i_u_ki_n_v_an_ninh_tr_t_t_h_t_n_ch_c_v_s_c_n_c_c_c_ng_d_n_ch_ng_minh_nh_n_d_n_ho_c_h_chi_u_c_a_ng_i_i_di_n_theo_ph_p_lu_t_ch_ng_lo_i_s_l_ng_ph_o_hoa_thu_c_ph_o_hoa_ph_ng_ti_n_v_n_chuy_n_bi_n_ki_m_so_t_c_a_kh_u_xu_t_kh_u_nh_p_kh_u_theo_m_u_quy_nh_t_i_ph_l_c_vi_ban_h_nh_k_m_theo_ngh_nh_s_56_2023_n_cp_tr_ng_h_p_t_ch_c_doanh_nghi_p_tr_c_ti_p_n_p_v_n_b_n_ngh_t_i_c_c_c_nh_s_t_qu_n_l_h_nh_ch_nh_v_tr_t_t_x_h_i_th_v_n_b_n_ngh_b_sung_h_t_n_s_c_n_c_c_c_ng_d_n_ch_ng_minh_nh_n_d_n_ho_c_h_chi_u_c_a_ng_i_n_li_n_h",
        "name": "Văn bản đề nghị ghi rõ tên, địa chỉ của tổ chức, doanh nghiệp thuộc Bộ Quốc phòng; mã số doanh nghiệp; số, ngày cấp giấy chứng nhận đủ điều kiện về an ninh trật tự; họ tên, chức vụ, số Căn cước công dân, Chứng minh nhân dân hoặc Hộ chiếu của người đại diện theo pháp luật; chủng loại, số lượng pháo hoa, thuốc pháo hoa; phương tiện vận chuyển, biển kiểm soát; cửa khẩu xuất khẩu, nhập khẩu theo mẫu quy định tại Phụ lục VI ban hành kèm theo Nghị định số 56/2023/NĐ-CP. Trường hợp tổ chức, doanh nghiệp trực tiếp nộp văn bản đề nghị tại Cục Cảnh sát Quản lý hành chính về trật tự xã hội thì văn bản đề nghị bổ sung họ tên, số Căn cước công dân, Chứng minh nhân dân hoặc Hộ chiếu của người đến liên hệ.",
        "group_name": "default",
        "group_type": "unknown",
        "original_count": "1",
        "copy_count": "0",
        "conditions": [
          "Văn bản đề nghị ghi rõ tên, địa chỉ của tổ chức, doanh nghiệp thuộc Bộ Quốc phòng; mã số doanh nghiệp; số, ngày cấp giấy chứng nhận đủ điều kiện về an ninh trật tự; họ tên, chức vụ, số Căn cước công dân, Chứng minh nhân dân hoặc Hộ chiếu của người đại diện theo pháp luật; chủng loại, số lượng pháo hoa, thuốc pháo hoa; phương tiện vận chuyển, biển kiểm soát; cửa khẩu xuất khẩu, nhập khẩu theo mẫu quy định tại Phụ lục VI ban hành kèm theo Nghị định số 56/2023/NĐ-CP. Trường hợp tổ chức, doanh nghiệp trực tiếp nộp văn bản đề nghị tại Cục Cảnh sát Quản lý hành chính về trật tự xã hội thì văn bản đề nghị bổ sung họ tên, số Căn cước công dân, Chứng minh nhân dân hoặc Hộ chiếu của người đến liên hệ."
        ],
        "attachment_label": "Phụ lục VI - NĐ56.docx",
        "attachment_path": "file:///C:/Users/ku060/Downloads/VAIC source/data-pipeline/raw_data/3_000169/Ph%E1%BB%A5%20l%E1%BB%A5c%20VI%20-%20N%C4%9056.docx"
      }
    ],
    "presented": [],
    "notes": [],
    "forms": [
      {
        "name": "Văn bản đề nghị ghi rõ tên, địa chỉ của tổ chức, doanh nghiệp thuộc Bộ Quốc phòng; mã số doanh nghiệp; số, ngày cấp giấy chứng nhận đủ điều kiện về an ninh trật tự; họ tên, chức vụ, số Căn cước công dân, Chứng minh nhân dân hoặc Hộ chiếu của người đại diện theo pháp luật; chủng loại, số lượng pháo hoa, thuốc pháo hoa; phương tiện vận chuyển, biển kiểm soát; cửa khẩu xuất khẩu, nhập khẩu theo mẫu quy định tại Phụ lục VI ban hành kèm theo Nghị định số 56/2023/NĐ-CP. Trường hợp tổ chức, doanh nghiệp trực tiếp nộp văn bản đề nghị tại Cục Cảnh sát Quản lý hành chính về trật tự xã hội thì văn bản đề nghị bổ sung họ tên, số Căn cước công dân, Chứng minh nhân dân hoặc Hộ chiếu của người đến liên hệ.",
        "attachment_label": "Phụ lục VI - NĐ56.docx",
        "attachment_path": "file:///C:/Users/ku060/Downloads/VAIC source/data-pipeline/raw_data/3_000169/Ph%E1%BB%A5%20l%E1%BB%A5c%20VI%20-%20N%C4%9056.docx"
      }
    ],
    "empty_groups": [],
    "document_count": 1
  },
  "process": {
    "steps": [
      {
        "step_id": "step_1",
        "title": null,
        "content": "1. -",
        "actor": "user",
        "channel_hint": null,
        "time_hint": null
      },
      {
        "step_id": "step_2",
        "title": "Bước 1:",
        "content": "Bước 1: Tổ chức, doanh nghiệp có nhu cầu nhập khẩu pháo hoa, thuốc pháo hoa nộp hồ sơ về Cục Cảnh sát quản lý hành chính về trật tự xã hội, Bộ Công an. -",
        "actor": "user",
        "channel_hint": null,
        "time_hint": null
      },
      {
        "step_id": "step_3",
        "title": "Bước 2:",
        "content": "Bước 2: Cán bộ tiếp nhận kiểm tra tính hợp lệ của hồ sơ đề nghị. Nếu văn bản đề nghị hợp lệ, đầy đủ nội dung thì tiếp nhận và giao giấy biên nhận hồ sơ, hẹn trả kết quả cho người được tổ chức, doanh nghiệp giao liên hệ thực hiện thủ tục hành chính. Trường hợp văn bản đề nghị chưa đầy đủ nội dung thì cán bộ tiếp nhận hồ sơ hướng dẫn đầy đủ, cụ thể một lần bằng văn bản cho tổ chức, doanh nghiệp hoàn thiện theo quy định. Trường hợp văn bản đề nghị không đủ điều kiện thì không tiếp nhận văn bản đề nghị và trả lời bằng văn bản lý do không tiếp nhận. -",
        "actor": "authority",
        "channel_hint": null,
        "time_hint": null
      },
      {
        "step_id": "step_4",
        "title": "Bước 3:",
        "content": "Bước 3: Căn cứ theo ngày hẹn trên giấy biên nhận, tổ chức, doanh nghiệp có nhu cầu nhập khẩu pháo hoa, thuốc pháo hoa nhận kết quả Giấy phép nhập khẩu pháo hoa, thuốc pháo hoa qua Cổng dịch vụ công quốc gia, Cổng dịch vụ công Bộ Công an, đường bưu chính hoặc nhận trực tiếp tại Cục Cảnh sát quản lý hành chính về trật tự xã hội, Bộ Công an.",
        "actor": "user",
        "channel_hint": "dịch vụ bưu chính",
        "time_hint": null
      }
    ],
    "step_count": 4,
    "notes": []
  },
  "eligibility": {
    "conditions": [],
    "has_conditions": false
  },
  "results": {
    "items": [
      {
        "name": "Giấy phép xuất khẩu, nhập khẩu pháo hoa, thuốc pháo hoa",
        "result_code": "KQ.G01.000034",
        "raw_text": "Giấy phép xuất khẩu, nhập khẩu pháo hoa, thuốc pháo hoa"
      }
    ],
    "primary_result": {
      "name": "Giấy phép xuất khẩu, nhập khẩu pháo hoa, thuốc pháo hoa",
      "result_code": "KQ.G01.000034",
      "raw_text": "Giấy phép xuất khẩu, nhập khẩu pháo hoa, thuốc pháo hoa"
    }
  },
  "legal_basis": {
    "items": [
      {
        "title": "Nghị định 137/2020/NĐ-CP",
        "code": "137/2020/NĐ-CP"
      },
      {
        "title": "Thông tư 23/2019/TT-BTC",
        "code": "23/2019/TT-BTC"
      },
      {
        "title": "Thông tư 218/2016/TT-BTC",
        "code": "218/2016/TT-BTC"
      },
      {
        "title": "Nghị định 56/2023/NĐ-CP",
        "code": "56/2023/NĐ-CP"
      }
    ],
    "count": 4
  },
  "attachments": [
    {
      "label": "Phụ lục VI - NĐ56.docx",
      "path": "file:///C:/Users/ku060/Downloads/VAIC source/data-pipeline/raw_data/3_000169/Ph%E1%BB%A5%20l%E1%BB%A5c%20VI%20-%20N%C4%9056.docx",
      "source_section": "Thành phần hồ sơ",
      "document_name": "Văn bản đề nghị ghi rõ tên, địa chỉ của tổ chức, doanh nghiệp thuộc Bộ Quốc phòng; mã số doanh nghiệp; số, ngày cấp giấy chứng nhận đủ điều kiện về an ninh trật tự; họ tên, chức vụ, số Căn cước công dân, Chứng minh nhân dân hoặc Hộ chiếu của người đại diện theo pháp luật; chủng loại, số lượng pháo hoa, thuốc pháo hoa; phương tiện vận chuyển, biển kiểm soát; cửa khẩu xuất khẩu, nhập khẩu theo mẫu quy định tại Phụ lục VI ban hành kèm theo Nghị định số 56/2023/NĐ-CP. Trường hợp tổ chức, doanh nghiệp trực tiếp nộp văn bản đề nghị tại Cục Cảnh sát Quản lý hành chính về trật tự xã hội thì văn bản đề nghị bổ sung họ tên, số Căn cước công dân, Chứng minh nhân dân hoặc Hộ chiếu của người đến liên hệ."
    }
  ],
  "signals": {
    "raw_parse_warnings": [],
    "missing_documents": false,
    "documents_section_present": true,
    "documents_declared_empty": false,
    "documents_only_in_notes": false,
    "missing_results": false
  }
}