{
  "schema_version": "1.0",
  "normalizer_version": "0.2.0",
  "source": {
    "procedure_code": "1.010653",
    "title": "Đổi Giấy phép hoạt động dịch vụ theo quy định tại điểm b khoản 1 Điều 74 của Luật Người lao động Việt Nam đi làm việc ở nước ngoài theo hợp đồng",
    "raw_structured_parser_version": "0.1.0",
    "field": "Quản lý lao động ngoài nước"
  },
  "procedure": {
    "level": "Cấp bộ/ngành",
    "procedure_type": "TTHC được luật giao quy định chi tiết",
    "target_users": [
      "Doanh nghiệp"
    ],
    "authorities": [
      "Bộ Nội vụ"
    ],
    "receiving_places": []
  },
  "submission": {
    "channels": [
      "in_person",
      "online",
      "postal"
    ],
    "methods": [
      {
        "method_id": "method_1",
        "channel": "online",
        "processing_time_text": "7 ngày làm việc",
        "fee_text": null,
        "description": null,
        "is_online": true,
        "is_postal": false,
        "is_in_person": false
      },
      {
        "method_id": "method_2",
        "channel": "postal",
        "processing_time_text": "7 ngày làm việc",
        "fee_text": null,
        "description": null,
        "is_online": false,
        "is_postal": true,
        "is_in_person": false
      },
      {
        "method_id": "method_3",
        "channel": "in_person",
        "processing_time_text": "7 ngày làm việc",
        "fee_text": null,
        "description": null,
        "is_online": false,
        "is_postal": false,
        "is_in_person": true
      }
    ],
    "timing_summary": {
      "unique_processing_times": [
        "7 ngày làm việc"
      ],
      "method_count": 3
    }
  },
  "documents": {
    "required": [
      {
        "document_id": "b_o_c_o_v_vi_c_p_ng_i_u_ki_n_quy_nh_t_i_c_c_i_m_a_b_d_v_e_kho_n_1_i_u_10_c_a_lu_t_ng_i_lao_ng_vi_t_nam_i_l_m_vi_c_n_c_ngo_i_theo_h_p_ng_theo_m_u_s_06_ph_l_c_i_ban_h_nh_k_m_theo_ngh_nh_s_372_2025_n_cp",
        "name": "Báo cáo về việc đáp ứng điều kiện quy định tại các điểm a, b, d, đ và e khoản 1 Điều 10 của Luật Người lao động Việt Nam đi làm việc ở nước ngoài theo hợp đồng (theo Mẫu số 06 Phụ lục I ban hành kèm theo Nghị định số 372/2025/NĐ-CP);",
        "group_name": "default",
        "group_type": "unknown",
        "original_count": "1",
        "copy_count": "0",
        "conditions": [],
        "attachment_label": "Mẫu số 06 Phụ lục I.docx",
        "attachment_path": "file:///C:/Users/ku060/Downloads/VAIC source/data-pipeline/raw_data/1_010653/M%E1%BA%ABu%20s%E1%BB%91%2006%20Ph%E1%BB%A5%20l%E1%BB%A5c%20I.docx"
      },
      {
        "document_id": "b_n_ch_nh_gi_y_ph_p_c_n_hi_u_l_c_c_c_p_theo_quy_nh_c_a_lu_t_ng_i_lao_ng_vi_t_nam_i_l_m_vi_c_n_c_ngo_i_theo_h_p_ng_s_72_2006_qh11",
        "name": "Bản chính Giấy phép còn hiệu lực đã được cấp theo quy định của Luật Người lao động Việt Nam đi làm việc ở nước ngoài theo hợp đồng số 72/2006/QH11.",
        "group_name": "default",
        "group_type": "unknown",
        "original_count": "1",
        "copy_count": "1",
        "conditions": [],
        "attachment_label": null,
        "attachment_path": null
      },
      {
        "document_id": "v_n_b_n_ngh_i_gi_y_ph_p_theo_m_u_s_05_ph_l_c_i_ban_h_nh_k_m_theo_ngh_nh_s_372_2025_n_cp",
        "name": "Văn bản đề nghị đổi Giấy phép (theo Mẫu số 05 Phụ lục I ban hành kèm theo Nghị định số 372/2025/NĐ-CP);",
        "group_name": "default",
        "group_type": "unknown",
        "original_count": "1",
        "copy_count": "0",
        "conditions": [],
        "attachment_label": "Mẫu số 05 Phụ lục I.docx",
        "attachment_path": "file:///C:/Users/ku060/Downloads/VAIC source/data-pipeline/raw_data/1_010653/M%E1%BA%ABu%20s%E1%BB%91%2005%20Ph%E1%BB%A5%20l%E1%BB%A5c%20I.docx"
      }
    ],
    "conditional": [],
    "presented": [],
    "notes": [],
    "forms": [
      {
        "name": "Báo cáo về việc đáp ứng điều kiện quy định tại các điểm a, b, d, đ và e khoản 1 Điều 10 của Luật Người lao động Việt Nam đi làm việc ở nước ngoài theo hợp đồng (theo Mẫu số 06 Phụ lục I ban hành kèm theo Nghị định số 372/2025/NĐ-CP);",
        "attachment_label": "Mẫu số 06 Phụ lục I.docx",
        "attachment_path": "file:///C:/Users/ku060/Downloads/VAIC source/data-pipeline/raw_data/1_010653/M%E1%BA%ABu%20s%E1%BB%91%2006%20Ph%E1%BB%A5%20l%E1%BB%A5c%20I.docx"
      },
      {
        "name": "Văn bản đề nghị đổi Giấy phép (theo Mẫu số 05 Phụ lục I ban hành kèm theo Nghị định số 372/2025/NĐ-CP);",
        "attachment_label": "Mẫu số 05 Phụ lục I.docx",
        "attachment_path": "file:///C:/Users/ku060/Downloads/VAIC source/data-pipeline/raw_data/1_010653/M%E1%BA%ABu%20s%E1%BB%91%2005%20Ph%E1%BB%A5%20l%E1%BB%A5c%20I.docx"
      }
    ],
    "empty_groups": [],
    "document_count": 3
  },
  "process": {
    "steps": [
      {
        "step_id": "step_1",
        "title": null,
        "content": "1. -",
        "actor": "user",
        "channel_hint": null,
        "time_hint": null
      },
      {
        "step_id": "step_2",
        "title": "Bước 1.",
        "content": "Bước 1. Doanh nghiệp dịch vụ nộp 01 bộ hồ sơ trực tiếp hoặc qua dịch vụ bưu chính tới Bộ Nội vụ hoặc trực tuyến tại Cổng dịch vụ công quốc gia https://dichvucong.gov.vn; -",
        "actor": "user",
        "channel_hint": "trực tuyến",
        "time_hint": null
      },
      {
        "step_id": "step_3",
        "title": "Bước 2.",
        "content": "Bước 2. Trong thời hạn 07 ngày làm việc kể từ ngày nhận đủ hồ sơ theo quy định, Bộ trưởng Bộ Nội vụ xem xét, cấp đổi Giấy phép cho doanh nghiệp dịch vụ. Trường hợp không cấp đổi Giấy phép, Bộ Nội vụ trả lời bằng văn bản và nêu rõ lý do.",
        "actor": "user",
        "channel_hint": null,
        "time_hint": "07 ngày làm việc"
      }
    ],
    "step_count": 3,
    "notes": []
  },
  "eligibility": {
    "conditions": [
      "Doanh nghiệp đáp ứng điều kiện quy định tại các điểm a, b, d, đ và e khoản 1 Điều 10 của Luật Người lao động Việt Nam đi làm việc ở nước ngoài theo hợp đồng ngày 13/11/2020."
    ],
    "has_conditions": true
  },
  "results": {
    "items": [
      {
        "name": "Giấy phép hoạt động dịch vụ đưa người lao động Việt Nam đi làm việc ở nước ngoài theo hợp đồng",
        "result_code": "KQ.G09.000472",
        "raw_text": "Giấy phép hoạt động dịch vụ đưa người lao động Việt Nam đi làm việc ở nước ngoài theo hợp đồng"
      }
    ],
    "primary_result": {
      "name": "Giấy phép hoạt động dịch vụ đưa người lao động Việt Nam đi làm việc ở nước ngoài theo hợp đồng",
      "result_code": "KQ.G09.000472",
      "raw_text": "Giấy phép hoạt động dịch vụ đưa người lao động Việt Nam đi làm việc ở nước ngoài theo hợp đồng"
    }
  },
  "legal_basis": {
    "items": [
      {
        "title": "Sửa đổi, bổ sung một số điều của Nghị định số 112/2021/NĐ-CР ngày 10 tháng 12 năm 2021 của Chính phủ quy định chi tiết một số điều và biện pháp thi hành Luật Người lao động Việt Nam đi làm việc ở nước ngoài theo hợp đồng",
        "code": "372/2025/NĐ-CP"
      },
      {
        "title": "NGHỊ ĐỊNH QUY ĐỊNH CHI TIẾT MỘT SỐ ĐIỀU VÀ BIỆN PHÁP THI HÀNH LUẬT NGƯỜI LAO ĐỘNG VIỆT NAM ĐI LÀM VIỆC Ở NƯỚC NGOÀI THEO HỢP ĐỒNG",
        "code": "112/2021/NĐ-CP"
      },
      {
        "title": "69-2020-QH14 Luật Ng VN đi LĐNN ngày 13.11.2020",
        "code": "69/2020/QH14"
      },
      {
        "title": "Nghị định số 25/2025/NĐ-CP ngày 21 tháng 02 năm 2025 của Chính phủ quy định chức năng, nhiệm vụ, quyền hạn và cơ cấu tổ chức của Bộ Nội vụ",
        "code": "Nghị định số 25/2025/NĐ-CP"
      },
      {
        "title": "Nghị quyết số 190/2025/QH15 của Quốc hội: Quy định về xử lý một số vấn đề liên quan đến sắp xếp tổ chức bộ máy nhà nước",
        "code": "190/2025/QH15"
      }
    ],
    "count": 5
  },
  "attachments": [
    {
      "label": "Mẫu số 06 Phụ lục I.docx",
      "path": "file:///C:/Users/ku060/Downloads/VAIC source/data-pipeline/raw_data/1_010653/M%E1%BA%ABu%20s%E1%BB%91%2006%20Ph%E1%BB%A5%20l%E1%BB%A5c%20I.docx",
      "source_section": "Thành phần hồ sơ",
      "document_name": "Báo cáo về việc đáp ứng điều kiện quy định tại các điểm a, b, d, đ và e khoản 1 Điều 10 của Luật Người lao động Việt Nam đi làm việc ở nước ngoài theo hợp đồng (theo Mẫu số 06 Phụ lục I ban hành kèm theo Nghị định số 372/2025/NĐ-CP);"
    },
    {
      "label": "Mẫu số 05 Phụ lục I.docx",
      "path": "file:///C:/Users/ku060/Downloads/VAIC source/data-pipeline/raw_data/1_010653/M%E1%BA%ABu%20s%E1%BB%91%2005%20Ph%E1%BB%A5%20l%E1%BB%A5c%20I.docx",
      "source_section": "Thành phần hồ sơ",
      "document_name": "Văn bản đề nghị đổi Giấy phép (theo Mẫu số 05 Phụ lục I ban hành kèm theo Nghị định số 372/2025/NĐ-CP);"
    }
  ],
  "signals": {
    "raw_parse_warnings": [],
    "missing_documents": false,
    "documents_section_present": true,
    "documents_declared_empty": false,
    "documents_only_in_notes": false,
    "missing_results": false
  }
}