{
  "schema_version": "1.0",
  "normalizer_version": "0.2.0",
  "source": {
    "procedure_code": "3.000603",
    "title": "Phê duyệt chủ trương đăng cai hội nghị, hội thảo quốc tế thuộc thẩm quyền của cấp trung ương",
    "raw_structured_parser_version": "0.1.0",
    "field": "Hội nghị, hội thảo quốc tế"
  },
  "procedure": {
    "level": "Cấp bộ/ngành",
    "procedure_type": "OTHER",
    "target_users": [
      "Doanh nghiệp",
      "Tổ chức nước ngoài",
      "Doanh nghiệp Việt Nam",
      "Doanh nghiệp có vốn đầu tư nước ngoài",
      "Tổ chức (không bao gồm doanh nghiệp",
      "HTX)"
    ],
    "authorities": [],
    "receiving_places": []
  },
  "submission": {
    "channels": [
      "in_person",
      "online",
      "postal"
    ],
    "methods": [
      {
        "method_id": "method_1",
        "channel": "in_person",
        "processing_time_text": "15 ngày làm việc",
        "fee_text": null,
        "description": "- Không quá 15 ngày làm việc kể từ ngày nhận đầy đủ hồ sơ hợp lệ đối với hội nghị, hội thảo quốc tế cần lấy ý kiến của cơ quan, địa phương liên quan.<br>- Không quá 09 ngày làm việc kể từ ngày nhận đầy đủ hồ sơ hợp lệ đối với các trường hợp khác.",
        "is_online": false,
        "is_postal": false,
        "is_in_person": true
      },
      {
        "method_id": "method_2",
        "channel": "online",
        "processing_time_text": "15 ngày làm việc",
        "fee_text": null,
        "description": "- Không quá 15 ngày làm việc kể từ ngày nhận đầy đủ hồ sơ hợp lệ đối với hội nghị, hội thảo quốc tế cần lấy ý kiến của cơ quan, địa phương liên quan.<br>- Không quá 09 ngày làm việc kể từ ngày nhận đầy đủ hồ sơ hợp lệ đối với các trường hợp khác.",
        "is_online": true,
        "is_postal": false,
        "is_in_person": false
      },
      {
        "method_id": "method_3",
        "channel": "postal",
        "processing_time_text": "15 ngày làm việc",
        "fee_text": null,
        "description": "- Không quá 15 ngày làm việc kể từ ngày nhận đầy đủ hồ sơ hợp lệ đối với hội nghị, hội thảo quốc tế cần lấy ý kiến của cơ quan, địa phương liên quan.<br>- Không quá 09 ngày làm việc kể từ ngày nhận đầy đủ hồ sơ hợp lệ đối với các trường hợp khác.",
        "is_online": false,
        "is_postal": true,
        "is_in_person": false
      }
    ],
    "timing_summary": {
      "unique_processing_times": [
        "15 ngày làm việc"
      ],
      "method_count": 3
    }
  },
  "documents": {
    "required": [
      {
        "document_id": "v_n_b_n_xin_ch_tr_ng_ng_cai_h_i_ngh_h_i_th_o_qu_c_t",
        "name": "văn bản xin chủ trương đăng cai hội nghị, hội thảo quốc tế.",
        "group_name": "default",
        "group_type": "unknown",
        "original_count": "1",
        "copy_count": "0",
        "conditions": [],
        "attachment_label": null,
        "attachment_path": null
      }
    ],
    "conditional": [],
    "presented": [],
    "notes": [],
    "forms": [],
    "empty_groups": [],
    "document_count": 1
  },
  "process": {
    "steps": [
      {
        "step_id": "step_1",
        "title": null,
        "content": "1. -",
        "actor": "user",
        "channel_hint": null,
        "time_hint": null
      },
      {
        "step_id": "step_2",
        "title": "Bước 1:",
        "content": "Bước 1: Đơn vị tổ chức hội nghị, hội thảo quốc tế quy định tại khoản 3 Điều 3 Quyết định số 30/2026/QĐ-TTg ngày 09 tháng 6 năm 2026 về tổ chức và quản lý hội nghị, hội thảo quốc tế tại Việt Nam thực hiện việc xin chủ trương trên Cổng Dịch vụ công Quốc gia hoặc nộp hồ sơ trực tiếp hoặc qua dịch vụ bưu chính đến cơ quan có thẩm quyền quy định tại các điểm c, d và đ khoản 1 Điều 5 Quyết định số 30/2026/QĐ-TTg. 2. -",
        "actor": "authority",
        "channel_hint": "dịch vụ bưu chính",
        "time_hint": "09 tháng"
      },
      {
        "step_id": "step_3",
        "title": "Bước 2:",
        "content": "Bước 2: Cơ quan có thẩm quyền kiểm tra hồ sơ. + Trường hợp từ thời điểm nhận đầy đủ hồ sơ hợp lệ tới thời điểm dự kiến tổ chức hội nghị, hội thảo quốc tế không đủ thời gian xử lý theo quy định, cơ quan có thẩm quyền có quyền yêu cầu điều chỉnh thời gian tổ chức hoặc trả lại hồ sơ. + Trường hợp hồ sơ chưa đầy đủ, chưa hợp lệ, trong thời hạn không quá 02 ngày làm việc, cơ quan có thẩm quyền có trách nhiệm yêu cầu và hướng dẫn đơn vị tổ chức cách thức điều chỉnh, bổ sung hồ sơ. Việc yêu cầu điều chỉnh, bổ sung hồ sơ thực hiện không quá 01 lần. Thời gian để đơn vị tổ chức điều chỉnh, bổ sung hồ sơ không quá 05 ngày làm việc kể từ ngày nhận được yêu cầu. Quá thời hạn trên mà chưa nhận được đầy đủ hồ sơ hợp lệ, cơ quan có thẩm quyền có quyền trả lại hồ sơ. 3. -",
        "actor": "authority",
        "channel_hint": null,
        "time_hint": "02 ngày làm việc"
      },
      {
        "step_id": "step_4",
        "title": "Bước 3:",
        "content": "Bước 3: Cơ quan có thẩm quyền thực hiện việc lấy ý kiến của cơ quan, địa phương liên quan đối với các trường hợp cần lấy ý kiến theo quy định tại Điều 9 Quyết định số 30/2026/QĐ-TTg.Cơ quan, địa phương được lấy ý kiến có trách nhiệm trả lời bằng văn bản trong thời hạn 07 ngày làm việc kể từ ngày nhận được văn bản đề nghị. Trường hợp các cơ quan, địa phương không thống nhất ý kiến hoặc không có văn bản trả lời, cơ quan có thẩm quyền chịu trách nhiệm quyết định việc phê duyệt hoặc không phê duyệt chủ trương đăng cai hội nghị, hội thảo quốc tế. 4. -",
        "actor": "authority",
        "channel_hint": null,
        "time_hint": "07 ngày làm việc"
      },
      {
        "step_id": "step_5",
        "title": "Bước 4:",
        "content": "Bước 4: Cơ quan có thẩm quyền trả lời bằng văn bản cho đơn vị tổ chức. + Trường hợp phê duyệt chủ trương đăng cai, cơ quan có thẩm quyền trả lời đơn vị tổ chức theo Mẫu số 05 tại Phụ lục kèm theo Quyết định số 30/2026/QĐ-TTg, đồng thời thông báo đến Bộ Công an và đến Ủy ban nhân dân cấp tỉnh nơi hội nghị, hội thảo quốc tế dự kiến tổ chức theo hình thức trực tiếp (trừ trường hợp tổ chức tại chính trụ sở của cơ quan có thẩm quyền cho chủ trương đăng cai hội nghị, hội thảo quốc tế) để phối hợp quản lý. + Trường hợp không phê duyệt, cơ quan có thẩm quyền trả lời đơn vị tổ chức bằng văn bản và nêu rõ lý do.",
        "actor": "authority",
        "channel_hint": "trực tiếp",
        "time_hint": null
      }
    ],
    "step_count": 5,
    "notes": []
  },
  "eligibility": {
    "conditions": [
      "- Hội nghị, hội thảo quốc tế không thuộc các trường hợp quy định tại khoản 2 Điều 1và khoản 1 Điều 6 Quyết định số 30/2026/QĐ-TTg.",
      "- Đơn vị tổ chức có nhu cầu đăng cai hội nghị, hội thảo quốc tế và cần có văn bản đồng ý của cơ quan hành chính nhà nước theo yêu cầu của phía nước ngoài.",
      "- Đơn vị tổ chức chưa có đầy đủ thông tin theo yêu cầu của thủ tục Cho phép tổ chức hội nghị, hội thảo quốc tế thuộc thẩm quyền của cấp trung ương."
    ],
    "has_conditions": true
  },
  "results": {
    "items": [
      {
        "name": "Văn bản trả lời đơn vị tổ chức về việc phê duyệt hoặc không phê duyệt chủ trương đăng cai hôi nghị, hội thảo quốc tế",
        "result_code": "KQ.G08.000097",
        "raw_text": "Văn bản trả lời đơn vị tổ chức về việc phê duyệt hoặc không phê duyệt chủ trương đăng cai hôi nghị, hội thảo quốc tế"
      }
    ],
    "primary_result": {
      "name": "Văn bản trả lời đơn vị tổ chức về việc phê duyệt hoặc không phê duyệt chủ trương đăng cai hôi nghị, hội thảo quốc tế",
      "result_code": "KQ.G08.000097",
      "raw_text": "Văn bản trả lời đơn vị tổ chức về việc phê duyệt hoặc không phê duyệt chủ trương đăng cai hôi nghị, hội thảo quốc tế"
    }
  },
  "legal_basis": {
    "items": [
      {
        "title": "Quyết định số 30/2026/QĐ-TTg ngày 09 tháng 6 năm 2026 của Thủ tướng Chính phủ về <br>tổ chức và quản lý hội nghị, hội thảo quốc tế tại Việt Nam.",
        "code": "30/2026/QĐ-TTg"
      }
    ],
    "count": 1
  },
  "attachments": [],
  "signals": {
    "raw_parse_warnings": [],
    "missing_documents": false,
    "documents_section_present": true,
    "documents_declared_empty": false,
    "documents_only_in_notes": false,
    "missing_results": false
  }
}