{
  "schema_version": "1.0",
  "normalizer_version": "0.2.0",
  "source": {
    "procedure_code": "3.000362",
    "title": "Cấp lại giấy phép sát hạch cho trung tâm sát hạch lái xe loại 3",
    "raw_structured_parser_version": "0.1.0",
    "field": "Sát hạch, cấp giấy phép lái xe"
  },
  "procedure": {
    "level": "Cấp tỉnh",
    "procedure_type": "OTHER",
    "target_users": [
      "Doanh nghiệp",
      "Hợp tác xã",
      "Tổ chức (không bao gồm doanh nghiệp",
      "HTX)"
    ],
    "authorities": [
      "Công an tỉnh"
    ],
    "receiving_places": []
  },
  "submission": {
    "channels": [
      "in_person",
      "postal"
    ],
    "methods": [
      {
        "method_id": "method_1",
        "channel": "postal",
        "processing_time_text": "5 ngày làm việc",
        "fee_text": null,
        "description": null,
        "is_online": false,
        "is_postal": true,
        "is_in_person": false
      },
      {
        "method_id": "method_2",
        "channel": "in_person",
        "processing_time_text": "5 ngày làm việc",
        "fee_text": null,
        "description": null,
        "is_online": false,
        "is_postal": false,
        "is_in_person": true
      }
    ],
    "timing_summary": {
      "unique_processing_times": [
        "5 ngày làm việc"
      ],
      "method_count": 2
    }
  },
  "documents": {
    "required": [
      {
        "document_id": "v_n_b_n_ngh_c_p_l_i_gi_y_ph_p_s_t_h_ch_theo_m_u",
        "name": "Văn bản đề nghị cấp lại giấy phép sát hạch (theo mẫu)",
        "group_name": "default",
        "group_type": "unknown",
        "original_count": "1",
        "copy_count": "0",
        "conditions": [],
        "attachment_label": null,
        "attachment_path": null
      }
    ],
    "conditional": [],
    "presented": [],
    "notes": [],
    "forms": [],
    "empty_groups": [],
    "document_count": 1
  },
  "process": {
    "steps": [
      {
        "step_id": "step_1",
        "title": null,
        "content": "1.",
        "actor": "user",
        "channel_hint": null,
        "time_hint": null
      },
      {
        "step_id": "step_2",
        "title": "a)",
        "content": "a) Nộp hồ sơ TTHC: Trung tâm sát hạch lái xe gửi văn bản đề nghị cấp lại giấy phép sát hạch đến Phòng Cảnh sát giao thông.",
        "actor": "user",
        "channel_hint": null,
        "time_hint": null
      },
      {
        "step_id": "step_3",
        "title": "b)",
        "content": "b) Giải quyết TTHC: * Trường hợp cấp lại khi có sự thay đổi về thiết bị sát hạch, chủng loại, số lượng xe cơ giới sử dụng để sát hạch lái xe: - Trong thời gian không quá 05 ngày làm việc kể từ ngày nhận văn bản đề nghị, Phòng Cảnh sát giao thông tổ chức kiểm tra, lập biên bản và cấp giấy phép sát hạch. Trường hợp không cấp, phải trả lời bằng văn bản và nêu rõ lý do; - Việc trả kết quả được thực hiện tại trụ sở Phòng Cảnh sát giao thông hoặc qua dịch vụ bưu chính. * Trường hợp cấp lại khi bị hỏng, mất, thay đổi tên của trung tâm sát hạch lái xe: - Trong thời hạn không quá 01 ngày làm việc kể từ ngày nhận văn bản đề nghị, Phòng Cảnh sát giao thông kiểm tra tính đầy đủ của hồ sơ; trường hợp hồ sơ chưa đầy đủ thì hướng dẫn tổ chức, cá nhân hoàn thiện theo quy định; trong thời hạn không quá 03 ngày làm việc kể từ ngày nhận đủ hồ sơ theo quy định, Phòng Cảnh sát giao thông cấp lại giấy phép sát hạch cho trung tâm sát hạch lái xe; trường hợp không cấp phải trả lời tổ chức, cá nhân bằng văn bản và nêu rõ lý do; - Việc trả kết quả được thực hiện tại trụ sở Phòng Cảnh sát giao thông hoặc qua dịch vụ bưu chính.",
        "actor": "user",
        "channel_hint": "dịch vụ bưu chính",
        "time_hint": "05 ngày làm việc"
      }
    ],
    "step_count": 3,
    "notes": []
  },
  "eligibility": {
    "conditions": [],
    "has_conditions": false
  },
  "results": {
    "items": [
      {
        "name": "Giấy phép sát hạch",
        "result_code": "KQ.G01.000187",
        "raw_text": "Giấy phép sát hạch"
      }
    ],
    "primary_result": {
      "name": "Giấy phép sát hạch",
      "result_code": "KQ.G01.000187",
      "raw_text": "Giấy phép sát hạch"
    }
  },
  "legal_basis": {
    "items": [
      {
        "title": "Quy định về hoạt động đào tạo và sát hạch lái xe.",
        "code": "160/2024/NĐ-CP"
      }
    ],
    "count": 1
  },
  "attachments": [],
  "signals": {
    "raw_parse_warnings": [],
    "missing_documents": false,
    "documents_section_present": true,
    "documents_declared_empty": false,
    "documents_only_in_notes": false,
    "missing_results": false
  }
}