{
  "schema_version": "1.0",
  "normalizer_version": "0.2.0",
  "source": {
    "procedure_code": "1.012899",
    "title": "Đăng ký cấp quyền khai thác, sử dụng thông tin, dữ liệu về nhà ở và thị trường bất động sản thuộc thẩm quyền giải quyết của Bộ Xây dựng",
    "raw_structured_parser_version": "0.1.0",
    "field": "Kinh doanh bất động sản"
  },
  "procedure": {
    "level": "Cấp bộ/ngành",
    "procedure_type": "TTHC được luật giao quy định chi tiết",
    "target_users": [
      "Doanh nghiệp có vốn đầu tư nước ngoài",
      "Công dân Việt Nam",
      "Doanh nghiệp",
      "Tổ chức (không bao gồm doanh nghiệp",
      "HTX)"
    ],
    "authorities": [
      "Bộ Xây dựng"
    ],
    "receiving_places": []
  },
  "submission": {
    "channels": [
      "in_person",
      "online",
      "postal"
    ],
    "methods": [
      {
        "method_id": "method_1",
        "channel": "online",
        "processing_time_text": "7 ngày làm việc",
        "fee_text": null,
        "description": null,
        "is_online": true,
        "is_postal": false,
        "is_in_person": false
      },
      {
        "method_id": "method_2",
        "channel": "postal",
        "processing_time_text": "7 ngày làm việc",
        "fee_text": null,
        "description": null,
        "is_online": false,
        "is_postal": true,
        "is_in_person": false
      },
      {
        "method_id": "method_3",
        "channel": "in_person",
        "processing_time_text": "7 ngày làm việc",
        "fee_text": null,
        "description": null,
        "is_online": false,
        "is_postal": false,
        "is_in_person": true
      }
    ],
    "timing_summary": {
      "unique_processing_times": [
        "7 ngày làm việc"
      ],
      "method_count": 3
    }
  },
  "documents": {
    "required": [
      {
        "document_id": "phi_u_ngh_c_p_quy_n_khai_th_c_th_ng_tin_d_li_u_v_nh_v_th_tr_ng_b_t_ng_s_n",
        "name": "Phiếu đề nghị cấp quyền khai thác thông tin, dữ liệu về nhà ở và thị trường bất động sản",
        "group_name": "default",
        "group_type": "unknown",
        "original_count": "1",
        "copy_count": "1",
        "conditions": [],
        "attachment_label": "Phiếu đề nghị cấp quyền.docx",
        "attachment_path": "file:///C:/Users/ku060/Downloads/VAIC source/data-pipeline/raw_data/1_012899/Phi%E1%BA%BFu%20%C4%91%E1%BB%81%20ngh%E1%BB%8B%20c%E1%BA%A5p%20quy%E1%BB%81n.docx"
      }
    ],
    "conditional": [],
    "presented": [],
    "notes": [],
    "forms": [
      {
        "name": "Phiếu đề nghị cấp quyền khai thác thông tin, dữ liệu về nhà ở và thị trường bất động sản",
        "attachment_label": "Phiếu đề nghị cấp quyền.docx",
        "attachment_path": "file:///C:/Users/ku060/Downloads/VAIC source/data-pipeline/raw_data/1_012899/Phi%E1%BA%BFu%20%C4%91%E1%BB%81%20ngh%E1%BB%8B%20c%E1%BA%A5p%20quy%E1%BB%81n.docx"
      }
    ],
    "empty_groups": [],
    "document_count": 1
  },
  "process": {
    "steps": [
      {
        "step_id": "step_1",
        "title": null,
        "content": "1. - Tổ chức, cá nhân có nhu cầu đăng ký cấp quyền khai thác, sử dụng thông tin, dữ liệu có tính chuyên sâu, chi tiết về nhà ở và thị trường bất động sản nộp 01 phiếu đề nghị cấp quyền khai thác thông tin dữ liệu về nhà ở và thị trường bất động sản đến Bộ phận tiếp nhận và trả kết quả giải quyết thủ tục hành chính của Bộ Xây dựng.",
        "actor": "user",
        "channel_hint": null,
        "time_hint": null
      },
      {
        "step_id": "step_2",
        "title": null,
        "content": "- Trong thời hạn không quá 07 ngày làm việc kể từ khi nhận được yêu cầu, Bộ Xây dựng xem xét cấp quyền truy cập quyền khai thác, sử dụng thông tin, dữ liệu về nhà ở và thị trường bất động sản hợp lệ; trường hợp từ chối cung cấp quyền khai thác, sử dụng phải trả lời và nêu rõ lý do.",
        "actor": "user",
        "channel_hint": null,
        "time_hint": "07 ngày làm việc"
      }
    ],
    "step_count": 2,
    "notes": []
  },
  "eligibility": {
    "conditions": [],
    "has_conditions": false
  },
  "results": {
    "items": [
      {
        "name": "Quyền truy cập quyền khai thác, sử dụng thông tin, dữ liệu về nhà ở và thị trường bất động sản hợp lệ",
        "result_code": "KQ.G17.000202",
        "raw_text": "Quyền truy cập quyền khai thác, sử dụng thông tin, dữ liệu về nhà ở và thị trường bất động sản hợp lệ"
      }
    ],
    "primary_result": {
      "name": "Quyền truy cập quyền khai thác, sử dụng thông tin, dữ liệu về nhà ở và thị trường bất động sản hợp lệ",
      "result_code": "KQ.G17.000202",
      "raw_text": "Quyền truy cập quyền khai thác, sử dụng thông tin, dữ liệu về nhà ở và thị trường bất động sản hợp lệ"
    }
  },
  "legal_basis": {
    "items": [
      {
        "title": "Về xây dựng và quản lý Hệ thống thông tin, cơ sở dữ liệu về nhà ở và thị trường bất động sản",
        "code": "357/2025/NĐ-CP"
      }
    ],
    "count": 1
  },
  "attachments": [
    {
      "label": "Phiếu đề nghị cấp quyền.docx",
      "path": "file:///C:/Users/ku060/Downloads/VAIC source/data-pipeline/raw_data/1_012899/Phi%E1%BA%BFu%20%C4%91%E1%BB%81%20ngh%E1%BB%8B%20c%E1%BA%A5p%20quy%E1%BB%81n.docx",
      "source_section": "Thành phần hồ sơ",
      "document_name": "Phiếu đề nghị cấp quyền khai thác thông tin, dữ liệu về nhà ở và thị trường bất động sản"
    }
  ],
  "signals": {
    "raw_parse_warnings": [],
    "missing_documents": false,
    "documents_section_present": true,
    "documents_declared_empty": false,
    "documents_only_in_notes": false,
    "missing_results": false
  }
}