{
  "schema_version": "1.0",
  "normalizer_version": "0.2.0",
  "source": {
    "procedure_code": "1.010217",
    "title": "Thủ tục đề nghị chấm dứt hợp đồng trong quá trình thực hiện nhiệm vụ khoa học và công nghệ cấp quốc gia thuộc Chương trình phát triển tài sản trí tuệ đến năm 2030",
    "raw_structured_parser_version": "0.1.0",
    "field": "Sở hữu trí tuệ"
  },
  "procedure": {
    "level": "Cấp bộ/ngành",
    "procedure_type": "TTHC được luật giao quy định chi tiết",
    "target_users": [
      "Doanh nghiệp Việt Nam",
      "Doanh nghiệp có vốn đầu tư nước ngoài",
      "Tổ chức (không bao gồm doanh nghiệp",
      "HTX)",
      "Doanh nghiệp",
      "Tổ chức nước ngoài",
      "Hợp tác xã"
    ],
    "authorities": [
      "Bộ Khoa học và Công nghệ"
    ],
    "receiving_places": []
  },
  "submission": {
    "channels": [
      "in_person",
      "online",
      "postal"
    ],
    "methods": [
      {
        "method_id": "method_1",
        "channel": "online",
        "processing_time_text": "7 ngày làm việc",
        "fee_text": null,
        "description": null,
        "is_online": true,
        "is_postal": false,
        "is_in_person": false
      },
      {
        "method_id": "method_2",
        "channel": "postal",
        "processing_time_text": "7 ngày làm việc",
        "fee_text": null,
        "description": null,
        "is_online": false,
        "is_postal": true,
        "is_in_person": false
      },
      {
        "method_id": "method_3",
        "channel": "in_person",
        "processing_time_text": "7 ngày làm việc",
        "fee_text": null,
        "description": null,
        "is_online": false,
        "is_postal": false,
        "is_in_person": true
      }
    ],
    "timing_summary": {
      "unique_processing_times": [
        "7 ngày làm việc"
      ],
      "method_count": 3
    }
  },
  "documents": {
    "required": [
      {
        "document_id": "b_o_c_o_n_i_dung_s_n_ph_m_khoa_h_c_v_c_ng_ngh_ho_n_th_nh_ang_tri_n_khai_v_ch_a_tri_n_khai",
        "name": "Báo cáo nội dung, sản phẩm khoa học và công nghệ đã hoàn thành, đang triển khai và chưa triển khai",
        "group_name": "default",
        "group_type": "unknown",
        "original_count": "1",
        "copy_count": "0",
        "conditions": [],
        "attachment_label": "1.010217_ Mẫu B12-BCĐK.docx",
        "attachment_path": "file:///C:/Users/ku060/Downloads/VAIC source/data-pipeline/raw_data/1_010217/1.010217_%20M%E1%BA%ABu%20B12-BC%C4%90K.docx"
      },
      {
        "document_id": "c_ng_v_n_gi_i_tr_nh_ngh_ch_m_d_t_h_p_ng_c_a_t_ch_c_ch_tr_ch_nhi_m_nhi_m_v",
        "name": "Công văn giải trình, đề nghị chấm dứt hợp đồng của tổ chức chủ trì, chủ nhiệm nhiệm vụ",
        "group_name": "default",
        "group_type": "unknown",
        "original_count": "1",
        "copy_count": "0",
        "conditions": [],
        "attachment_label": null,
        "attachment_path": null
      },
      {
        "document_id": "h_p_ng_thuy_t_minh_nhi_m_v_k_gi_a_t_ch_c_ch_tr_ch_nhi_m_nhi_m_v_v_i_c_c_s_h_u_tr_tu",
        "name": "Hợp đồng, Thuyết minh nhiệm vụ đã ký giữa tổ chức chủ trì, chủ nhiệm nhiệm vụ với Cục Sở hữu trí tuệ",
        "group_name": "default",
        "group_type": "unknown",
        "original_count": "0",
        "copy_count": "1",
        "conditions": [],
        "attachment_label": null,
        "attachment_path": null
      },
      {
        "document_id": "b_o_c_o_t_nh_h_nh_s_d_ng_thanh_quy_t_to_n_kinh_ph",
        "name": "Báo cáo tình hình sử dụng, thanh quyết toán kinh phí",
        "group_name": "default",
        "group_type": "unknown",
        "original_count": "1",
        "copy_count": "0",
        "conditions": [],
        "attachment_label": "1.010217_Mẫu B13-BCKP.docx",
        "attachment_path": "file:///C:/Users/ku060/Downloads/VAIC source/data-pipeline/raw_data/1_010217/1.010217_M%E1%BA%ABu%20B13-BCKP.docx"
      }
    ],
    "conditional": [
      {
        "document_id": "t_i_li_u_kh_c_n_u_c",
        "name": "Tài liệu khác (nếu có)",
        "group_name": "default",
        "group_type": "unknown",
        "original_count": "1",
        "copy_count": "0",
        "conditions": [
          "Tài liệu khác (nếu có)"
        ],
        "attachment_label": null,
        "attachment_path": null
      }
    ],
    "presented": [],
    "notes": [],
    "forms": [
      {
        "name": "Báo cáo nội dung, sản phẩm khoa học và công nghệ đã hoàn thành, đang triển khai và chưa triển khai",
        "attachment_label": "1.010217_ Mẫu B12-BCĐK.docx",
        "attachment_path": "file:///C:/Users/ku060/Downloads/VAIC source/data-pipeline/raw_data/1_010217/1.010217_%20M%E1%BA%ABu%20B12-BC%C4%90K.docx"
      },
      {
        "name": "Báo cáo tình hình sử dụng, thanh quyết toán kinh phí",
        "attachment_label": "1.010217_Mẫu B13-BCKP.docx",
        "attachment_path": "file:///C:/Users/ku060/Downloads/VAIC source/data-pipeline/raw_data/1_010217/1.010217_M%E1%BA%ABu%20B13-BCKP.docx"
      }
    ],
    "empty_groups": [],
    "document_count": 5
  },
  "process": {
    "steps": [
      {
        "step_id": "step_1",
        "title": null,
        "content": "1. -",
        "actor": "user",
        "channel_hint": null,
        "time_hint": null
      },
      {
        "step_id": "step_2",
        "title": "Bước 1:",
        "content": "Bước 1: Tổ chức chủ trì, chủ nhiệm nhiệm vụ nộp Hồ sơ đề nghị chấm dứt hợp đồng tới Cục Sở hữu trí tuệ. -",
        "actor": "user",
        "channel_hint": null,
        "time_hint": null
      },
      {
        "step_id": "step_3",
        "title": "Bước 2:",
        "content": "Bước 2: Cục Sở hữu trí tuệ tiếp nhận hồ sơ, xem xét các quy định có liên quan đến từng trường hợp cụ thể trước khi báo cáo Bộ trưởng Bộ Khoa học và Công nghệ. -",
        "actor": "user",
        "channel_hint": null,
        "time_hint": null
      },
      {
        "step_id": "step_4",
        "title": "Bước 3:",
        "content": "Bước 3: Cục Sở hữu trí tuệ trình Bộ trưởng Bộ Khoa học và Công nghệ xem xét, quyết định dừng thực hiện nhiệm vụ và thông báo tạm dừng thực hiện nhiệm vụ cho tổ chức chủ trì, chủ nhiệm nhiệm vụ. -",
        "actor": "user",
        "channel_hint": null,
        "time_hint": null
      },
      {
        "step_id": "step_5",
        "title": "Bước 4:",
        "content": "Bước 4: Bộ Khoa học và Công nghệ ban hành quyết định chấm dứt hợp đồng hoặc gửi văn bản trả lời tới tổ chức chủ trì, chủ nhiệm nhiệm vụ nêu rõ lý do trong trường hợp không đồng ý chấm dứt hợp đồng.",
        "actor": "user",
        "channel_hint": null,
        "time_hint": null
      }
    ],
    "step_count": 5,
    "notes": []
  },
  "eligibility": {
    "conditions": [
      "- Có căn cứ để khẳng định việc thực hiện hoặc tiếp tục thực hiện nhiệm vụ là không cần thiết và hai bên đồng ý chấm dứt họp đồng trước thời hạn;",
      "- Nhiệm vụ không thể tiếp tục thực hiện do Bộ Khoa học và Công nghệ không cấp đủ kinh phí theo tiến độ thực hiện nhiệm vụ mà không có lý do chính đáng, hoặc không giải quyết những kiến nghị, đề xuất của tổ chức chủ trì, chủ nhiệm nhiệm vụ theo quy định của pháp luật."
    ],
    "has_conditions": true
  },
  "results": {
    "items": [
      {
        "name": "Quyết định chấm dứt hợp đồng thực hiện nhiệm vụ cấp quốc gia của Bộ trưởng Bộ Khoa học và Công nghệ",
        "result_code": "KQ.G06.000327",
        "raw_text": "Quyết định chấm dứt hợp đồng thực hiện nhiệm vụ cấp quốc gia của Bộ trưởng Bộ Khoa học và Công nghệ"
      }
    ],
    "primary_result": {
      "name": "Quyết định chấm dứt hợp đồng thực hiện nhiệm vụ cấp quốc gia của Bộ trưởng Bộ Khoa học và Công nghệ",
      "result_code": "KQ.G06.000327",
      "raw_text": "Quyết định chấm dứt hợp đồng thực hiện nhiệm vụ cấp quốc gia của Bộ trưởng Bộ Khoa học và Công nghệ"
    }
  },
  "legal_basis": {
    "items": [
      {
        "title": "Thông tư 04/2015/TT-BKHCN",
        "code": "04/2015/TT-BKHCN"
      },
      {
        "title": "Thông tư số 03/2021/TT-BKHCN ngày 11 tháng 6 năm 2021 của Bộ trưởng Bộ Khoa học và Công nghệ quy định về quản lý Chương trình phát triển tài sản trí tuệ đến năm 2030",
        "code": "Thông tư số 03/2021/TT-BKHCN"
      },
      {
        "title": "Quyết định số 2205/QĐ-TTg ngày 24 tháng 12 năm 2020 của Thủ tướng Chính phủ về việc phê duyệt Chương trình phát triển tài sản trí tuệ đến năm 2030",
        "code": "Quyết định số 2205/QĐ-TTg"
      }
    ],
    "count": 3
  },
  "attachments": [
    {
      "label": "1.010217_ Mẫu B12-BCĐK.docx",
      "path": "file:///C:/Users/ku060/Downloads/VAIC source/data-pipeline/raw_data/1_010217/1.010217_%20M%E1%BA%ABu%20B12-BC%C4%90K.docx",
      "source_section": "Thành phần hồ sơ",
      "document_name": "Báo cáo nội dung, sản phẩm khoa học và công nghệ đã hoàn thành, đang triển khai và chưa triển khai"
    },
    {
      "label": "1.010217_Mẫu B13-BCKP.docx",
      "path": "file:///C:/Users/ku060/Downloads/VAIC source/data-pipeline/raw_data/1_010217/1.010217_M%E1%BA%ABu%20B13-BCKP.docx",
      "source_section": "Thành phần hồ sơ",
      "document_name": "Báo cáo tình hình sử dụng, thanh quyết toán kinh phí"
    }
  ],
  "signals": {
    "raw_parse_warnings": [],
    "missing_documents": false,
    "documents_section_present": true,
    "documents_declared_empty": false,
    "documents_only_in_notes": false,
    "missing_results": false
  }
}